{
  "status": "framework_ready",
  "checked_at": "2026-05-21T17:53:27.519Z",
  "source_count": 2,
  "sources": [
    {
      "source_id": "edpb-publications-rss",
      "source_name": "European Data Protection Board (EDPB) — publications RSS",
      "monitoring_status": "manual_only",
      "adapter_type": "rss_metadata_fixture",
      "official_url": "https://www.edpb.europa.eu/feed/publications_en",
      "fixture_snapshot_version": "v2",
      "item_count": 3,
      "metadata_hash": "8875ea2c41173b83",
      "allowed_for_network_check": false,
      "stores_metadata_only": true
    },
    {
      "source_id": "edps-news-rss",
      "source_name": "European Data Protection Supervisor (EDPS) — news RSS",
      "monitoring_status": "design_ready",
      "adapter_type": "rss_metadata_fixture",
      "official_url": "https://www.edps.europa.eu/feed/news_en",
      "fixture_snapshot_version": "v1",
      "item_count": 1,
      "metadata_hash": "b57195d738e1e8f8",
      "allowed_for_network_check": false,
      "stores_metadata_only": true
    }
  ],
  "latest_fixture_snapshot_at": "2026-05-21T10:00:00.000Z",
  "detected_metadata_changes_count": 1,
  "runtime_flags": {
    "live_ingestion_enabled": false,
    "scheduled_monitoring_enabled": false,
    "network_execution_enabled": false
  },
  "gates": {
    "verified_on_source": false,
    "client_use_allowed": false,
    "client_evidence_allowed": false,
    "final_evidence_allowed": false,
    "legal_change_claimed": false,
    "publication_allowed": false,
    "public_export_allowed": false
  },
  "public_note": "T075A controlled source pilot framework. Fixture-only metadata snapshots; no live network execution, no scheduled monitoring, no full legal text. Supabase runtime connection and explicit network approval required for next phases."
}
